CORPORATE_IDENTIFICATION_NUMBER,Company_Name,Company_status,Company_class,Company_Category,Company_sub_category,DATE_OF_REGISTRATION,REGISTERED_STATE,AUTHORIZED_CAP,PAIDUP_CAPITAL,Industrial_Class,PRINCIPAL_BUSINESS_ACTIVITY_AS_PER_CIN,Registered_Office_Address,REGISTRAR_OF_COMPANIES,EMAIL_ADDR,Latest_Year_AR,Latest_Year_BS,,,
U74999MN2016PTC013509,SUIGENERIS AGRONOMY PRIVATE LIMITED,Active,Private,Company limited by Shares,Non-govt company,29-12-16,Manipur,16500000,14285720,74999,Other business activities,"The Suigeneris House, Kwakeithel Lamdong Leikai, Imphal West , West Imphal Unclassified MN 795001",RoC-Shillong,rageshkeisham@thesuigeneris.in,31-03-20,31-03-20,,,
U74999MN2017NPL013613,UKHRUL HILLS DEVELOPMENT FOUNDATION,Active,Private,Company limited by Shares,Non-govt company,20-12-17,Manipur,100000,30719,74999,Other business activities,"HUISHU VILLAGE, UKHRUL VIEWLAND JESSAMI JUNCTION UKHRUL , Ukhrul Unclassified MN 795142",RoC-Shillong,gs_achui@yahoo.com,31-03-19,31-03-19,,,
U74999MN2017NPL013615,KOROU EDUCATION FOUNDATION,Active,Private,Company limited by Shares,Non-govt company,27-12-17,Manipur,100000,100000,74999,Other business activities,"East Phungreitang near old district hospital ukhrul , Ukhrul Unclassified MN 795142",RoC-Shillong,ansary.shent@gmail.com,31-03-20,31-03-20,,,
U74999MN2017OPC013554,PUKEI LANGEI VENTURES (OPC) PRIVATELIMITED,Strike Off,Private(One Person Company),Company limited by Shares,Non-govt company,28-07-17,Manipur,100000,50000,74999,Other business activities,"Kakching Wairi Sabal Leikai, Sabal Pareng, Kakching , Thoubal Unclassified MN 795103",RoC-Shillong,indra4463@gmail.com,31-03-18,31-03-18,,,
U74999MN2017OPC013596,HISCO RETAIL & MARKETING (OPC) PRIVATELIMITED,Active,Private(One Person Company),Company limited by Shares,Non-govt company,24-10-17,Manipur,100000,100000,74999,Other business activities,"C/O S/O H. CHAOBA SINGH, YAISKUL HIRUHANBA LEIKAI MANIPUR , West Imphal Unclassified MN 795001",RoC-Shillong,hijampinky38@gmail.com,31-03-19,31-03-19,,,
U74999MN2017PTC013510,THADDAEUS NUTRACEUTICALS PRIVATE LIMITED,Active,Private,Company limited by Shares,Non-govt company,05-01-17,Manipur,100000,100000,74999,Other business activities,"KAKWA NAMEIRAKPAM LEIKAI THONGJU II IMPHAL , East Imphal Unclassified MN 795008",RoC-Shillong,asem.robinson@gmail.com,31-03-20,31-03-20,,,
U74999MN2017PTC013513,MAHUM CONSULTANTS PRIVATE LIMITED,Active,Private,Company limited by Shares,Non-govt company,14-02-17,Manipur,1000000,100000,74999,Other business activities,"Thangjing Road Opp. SBI Moirang Branch Moirang , Bishnupur Unclassified MN 795133",RoC-Shillong,mahumconsultants@gmail.com,31-03-20,31-03-20,,,
U74999MN2017PTC013517,IMPHAL GENERACION TECHNOTINE PRIVATELIMITED,Active,Private,Company limited by Shares,Non-govt company,27-02-17,Manipur,100000,100000,74999,Other business activities,"Uripok Sorbon Thingel, Next to IOC Petrol Pump Imphal West , West Imphal Unclassified MN 795001",RoC-Shillong,khpariyaimeitei@gmail.com,31-03-18,31-03-18,,,
U74999MN2017PTC013522,KOMOL AND KUMARI TECHNOLOGIES PRIVATELIMITED,Active,Private,Company limited by Shares,Non-govt company,03-04-17,Manipur,100000,100000,74999,Other business activities,"GHARI AWANG LEIKAI IMPHAL WEST IMPHAL , West Imphal Unclassified MN 795001",RoC-Shillong,shilan.heisnam@gmail.com,31-03-20,31-03-20,,,
U74999MN2017PTC013525,MIRAQUE SOLUTIONS PRIVATE LIMITED,Active,Private,Company limited by Shares,Non-govt company,28-04-17,Manipur,100000,100000,74999,Other business activities,"Thangmeiband Hijam Dewan Leikai Khomdram Selungba Leirak Lamphel, , West Imphal Unclassified MN 795004",RoC-Shillong,leichombam@gmail.com,NA,NA,,,
U74999MN2017PTC013532,KHORJEI RESEARCH AND CONSULTING PRIVATELIMITED,Active,Private,Company limited by Shares,Non-govt company,16-05-17,Manipur,100000,100000,74999,Other business activities,"24 1, M I Road, Ningombam Pukhri Achouba Manak, Ningombam Thonju Leikai, Thoubal Ningombam, , Thoubal Unclassified MN 795138",RoC-Shillong,ibomchameetei@gmail.com,31-03-18,31-03-18,,,
U74999MN2017PTC013539,MEDILANE HEALTHTECH AND CONSULTANCYSERVICES PRIVATE LIMITED,Active,Private,Company limited by Shares,Non-govt company,14-06-17,Manipur,1000000,500000,74999,Other business activities,"POROMPAT NEAR JNIMS HOSPITAL IMPHAL EAST IMPHAL , West Imphal Unclassified MN 795001",RoC-Shillong,medilane.in@gmail.com,31-03-20,31-03-20,,,
U74999MN2017PTC013543,PIBAREL ENTERPRISES PRIVATE LIMITED,Active,Private,Company limited by Shares,Non-govt company,28-06-17,Manipur,100000,100000,74999,Other business activities,"SINGJAMEI MAKHA SOROKHAIBAM LEIKAI,P.O/P.S- SINGJAMEI NEAR DAOJI SCHOOL, IMPHAL WEST DISTRICT IMPHAL , East Imphal Unclassified MN 795008",RoC-Shillong,LEOSINGH512345@GMAIL.COM,31-03-19,31-03-20,,,
U74999MN2017PTC013545,MNS GOODS AND GROCER RETAIL CHAINPRIVATE LIMITED,Active,Private,Company limited by Shares,Non-govt company,03-07-17,Manipur,100000,100000,74999,Other business activities,"Thangmeiband, Lourung Peral Lelkai, Opp. NCC OFFICERS MESS, IMPHAL , West Imphal Unclassified MN 795001",RoC-Shillong,Shangkhubi@gmail.com,31-03-19,31-03-19,,,
U74999MN2017PTC013546,TENIBARE CONSULTANTS PRIVATE LIMITED,Active,Private,Company limited by Shares,Non-govt company,10-07-17,Manipur,100000,100000,74999,Other business activities,"Top Khongnang Makhong Porompat Imphal , East Imphal Unclassified MN 795001",RoC-Shillong,meghachandra71@gmail.com,31-03-20,31-03-20,,,
U74999MN2017PTC013550,CYGEN CONSULTANCY PRIVATE LIMITED,Active,Private,Company limited by Shares,Non-govt company,20-07-17,Manipur,100000,100000,74999,Other business activities,"Haobam Marak, Keisham Leikai Bamon Ani Leirak Imphal West , West Imphal Unclassified MN 795008",RoC-Shillong,dr.tanushree@cygengroup.com,31-03-20,31-03-20,,,
U74999MN2017PTC013551,NETWORKMASTER SOFTWARE SOLUTIONS PRIVATELIMITED,Active,Private,Company limited by Shares,Non-govt company,20-07-17,Manipur,100000,100000,74999,Other business activities,"CANCHIPUR NEAR PECHU LAMPAK, IMPHAL IMPHAL , East Imphal Unclassified MN 795003",RoC-Shillong,csnishamunka@yahoo.com,31-03-19,31-03-19,,,
U74999MN2017PTC013556,TINGPLIK INFRA AND ENERGY SERVICESPRIVATE LIMITED,Active,Private,Company limited by Shares,Non-govt company,01-08-17,Manipur,100000,100000,74999,Other business activities,"Neikanlong Thangmeiband PO Lamphel Impal West , West Imphal Unclassified MN 795004",RoC-Shillong,wilsongangmei@gmail.com,NA,NA,,,
U74999MN2017PTC013562,KONGBAM CONSTRUCTION PRIVATE LIMITED,Active,Private,Company limited by Shares,Non-govt company,18-08-17,Manipur,100000,100000,74999,Other business activities,"YAIRIPOK TOP CHINGTHA KONGBAM LEIRAK TOP CHINGTHA IMPHAL EAST , Thoubal Unclassified MN 795149",RoC-Shillong,KKISHOR7681KANG@GMAIL.COM,NA,NA,,,
U74999MN2017PTC013564,NONGPOKTHONG VENTURES PRIVATE LIMITED,Active,Private,Company limited by Shares,Non-govt company,22-08-17,Manipur,100000,100000,74999,Other business activities,"Molrangkhom Makha, Loklaobung, Indo-Burma Road, Imphal West , West Imphal Unclassified MN 795001",RoC-Shillong,ronny.waikhom@gmail.com,NA,NA,,,
U74999MN2017PTC013566,MAPOK COLD STORAGE PRIVATE LIMITED,Active,Private,Company limited by Shares,Non-govt company,25-08-17,Manipur,100000,100000,74999,Other business activities,"Revenue Village no.61, Irengband Thoubal Distt. Irengband , Thoubal Unclassified MN 795103",RoC-Shillong,joy383883@gmail.com,NA,NA,,,
U74999MN2017PTC013570,KHONGSAI CONSTRUCTION AND SUPPLIERPRIVATE LIMITED,Active,Private,Company limited by Shares,Non-govt company,30-08-17,Manipur,100000,100000,74999,Other business activities,"LAMPHEL SUPER MARKET PO LAMPHEL P.S LAMPHEL, IMPHAL WEST , West Imphal Unclassified MN 795001",RoC-Shillong,bdave@legalwiz.in,NA,NA,,,
U74999MN2017PTC013571,ZALEN CONSTRUCTION AND SUPPLIER PRIVATELIMITED,Active,Private,Company limited by Shares,Non-govt company,30-08-17,Manipur,100000,100000,74999,Other business activities,"LANGOL GAME VILLAGE PO LAMPHEL P.S LAMPHEL, IMPHAL WEST , West Imphal Unclassified MN 795001",RoC-Shillong,bdave@legalwiz.in,NA,NA,,,
U74999MN2017PTC013573,UNUNI CONSULTANCY PRIVATE LIMITED,Active,Private,Company limited by Shares,Non-govt company,31-08-17,Manipur,1000000,100000,74999,Other business activities,"C/o Salam Mani Singh Naranseina Awang Bishnupur , Bishnupur Unclassified MN 795133",RoC-Shillong,infoununi@mail.ru,NA,NA,,,
U74999MN2017PTC013575,BLOW BRISAS MEDIA AND ENTERTAINMENTPRIVATE LIMITED,Active,Private,Company limited by Shares,Non-govt company,05-09-17,Manipur,65000,65000,74999,Other business activities,"SAGOLBAND TERA AMUDON LEIRAK MACHIN, AKHAM LEIKAI IMPHAL , West Imphal Unclassified MN 795001",RoC-Shillong,sbntsharma@gmail.com,31-03-20,31-03-20,,,
U74999MN2017PTC013578,TANTHA ENTERTAINMENT PRIVATE LIMITED,Active,Private,Company limited by Shares,Non-govt company,18-09-17,Manipur,1000000,10000,74999,Other business activities,"Uripok Haorongbam Leikai RIMS Gate, Near MM Gas Booking Counter Imphal West , West Imphal Unclassified MN 795001",RoC-Shillong,priacrotchet19@gmail.com,31-03-20,31-03-20,,,
U74999MN2017PTC013580,JENKAM PRIVATE LIMITED,Active,Private,Company limited by Shares,Non-govt company,21-09-17,Manipur,100000,100000,74999,Other business activities,"YAIRIPOK LAIMANAI TOP- CHINGTHA IMPHAL EAST MANIPUR , East Imphal Unclassified MN 795149",RoC-Shillong,ajeniljosh@gmail.com,NA,NA,,,
U74999MN2017PTC013581,RANUNCULUS CONSULTANCY PRIVATE LIMITED,Strike Off,Private,Company limited by Shares,Non-govt company,22-09-17,Manipur,100000,100000,74999,Other business activities,"C/o Thounaojam Shantikumar Singh, Chingmeirong, P.O. Lamlong, P.S. LAMPHEL IMPHAL , East Imphal Unclassified MN 795010",RoC-Shillong,manasvimudgal@gmail.com,31-03-18,31-03-18,,,
U74999MN2017PTC013582,DANGMEI GAIDINGAM ORGANIC FARMINGPRIVATE LIMITED,Active,Private,Company limited by Shares,Non-govt company,04-10-17,Manipur,100000,100000,74999,Other business activities,"C/O GONMEI KAJAIGAI PANDON RAGAILONG IMPHAL , West Imphal Unclassified MN 795001",RoC-Shillong,KAJAIGAI82@GMAIL.COM,31-03-19,31-03-19,,,
U74999MN2017PTC013583,SANGAI ADVERTISING PRIVATE LIMITED,Active,Private,Company limited by Shares,Non-govt company,05-10-17,Manipur,1000000,200000,74999,Other business activities,"SANGAIPROU TIDDIM ROAD NA IMPHAL , West Imphal Unclassified MN 795140",RoC-Shillong,transasialtd@rediffmail.com,NA,NA,,,
U74999MN2017PTC013586,BRAJKON ORGANICS PRIVATE LIMITED,Active,Private,Company limited by Shares,Non-govt company,09-10-17,Manipur,1000000,1000000,74999,Other business activities,"C/O W. BRAJABIDHU SINGH,11-B-2/17, KID WORLD COMPLEX,AIRPORT ROAD, GHARI IMPHAL , West Imphal Unclassified MN 795001",RoC-Shillong,BRAJAWAHENGBAM@GMAIL.COM,31-03-20,31-03-20,,,
U74999MN2017PTC013587,YOIHEN ANGOMCHA CRAFT PRIVATE LIMITED,Active,Private,Company limited by Shares,Non-govt company,11-10-17,Manipur,100000,50000,74999,Other business activities,"House No 22 Sagolband Moirang Mayum Leirak Imphal West , West Imphal Unclassified MN 795001",RoC-Shillong,suziningthem@gmail.com,31-03-20,31-03-20,,,
U74999MN2017PTC013589,WAKOKLOL BUSINESS CONSULTING PRIVATELIMITED,Active,Private,Company limited by Shares,Non-govt company,16-10-17,Manipur,500000,200000,74999,Other business activities,"3543 DL-45 DEULAHLAND IMPHAL , East Imphal Unclassified MN 795001",RoC-Shillong,gunadhor@wakoklol.com,31-03-20,31-03-20,,,
U74999MN2017PTC013590,BIGOPRI RISE PRIVATE LIMITED,Active,Private,Company limited by Shares,Non-govt company,16-10-17,Manipur,100000,100000,74999,Other business activities,"C/o Bikram Kshetrimayum Pangei Bazar Imphal East , East Imphal Unclassified MN 795001",RoC-Shillong,bikramkshetrimayum121@gmail.com,NA,NA,,,
U74999MN2017PTC013591,LUWANG & SONS ECOMMERCE PRIVATE LIMITED,Active,Private,Company limited by Shares,Non-govt company,17-10-17,Manipur,100000,100000,74999,Other business activities,"HOUSE NO 147, TOP MAYAI LEIKAI POROMPAT D C ROAD, NEAR MOBILE TOWER, IMPHAL EAST MANIPUR , East Imphal Unclassified MN 795005",RoC-Shillong,AMARTINSINGH@GMAIL.COM,31-03-20,31-03-20,,,
U74999MN2017PTC013594,ARAMBAM BROS & CONSULTANTS PRIVATELIMITED,Active,Private,Company limited by Shares,Non-govt company,18-10-17,Manipur,100000,100000,74999,Other business activities,"HOUSE NO.152 BRAHMAPUR MANGE MAKHONG IMPHAL-, WANGKHEI SUB DIVISION MANIPUR MANIPUR , East Imphal Unclassified MN 795001",RoC-Shillong,consults.abc@gmail.com,NA,NA,,,
U74999MN2017PTC013595,MORKONS ECOM PRIVATE LIMITED,Active,Private,Company limited by Shares,Non-govt company,23-10-17,Manipur,100000,100000,74999,Other business activities,"1782 , NS: 30/13 , SECOND STREET , NEW LAMBULANE IMPHAL , West Imphal Unclassified MN 795001",RoC-Shillong,HAOKIP.LALAM@YAHOO.CO.IN,NA,NA,,,
U74999MN2017PTC013599,KANGLA BROADBAND PRIVATE LIMITED,Active,Private,Company limited by Shares,Non-govt company,07-11-17,Manipur,1000000,500000,74999,Other business activities,"BRAMACHARIMAYUM SHARMA RISHIKESH KEISHAMPAT, LEIMAJAM LEIKAI, IMPHAL , West Imphal Unclassified MN 795001",RoC-Shillong,brishisharma@gmail.com,31-03-20,31-03-20,,,
U74999MN2017PTC013604,OOREP SPORTS PRIVATE LIMITED,Active,Private,Company limited by Shares,Non-govt company,16-11-17,Manipur,400000,100000,74999,Other business activities,"IED-III, 9-E-25/13, Singjamei Thongam Leikai, Imphal West , West Imphal Unclassified MN 795008",RoC-Shillong,oorepsports@gmail.com,NA,NA,,,
U74999MN2017PTC013605,KANGLEIPAK ENTERPRISES PRIVATE LIMITED,Active,Private,Company limited by Shares,Non-govt company,20-11-17,Manipur,5000000,1000000,74999,Other business activities,"C/o Dr. Khumuckcham Jelen Singh Thangmeiband Tarung Rd. Imphal , West Imphal Unclassified MN 795004",RoC-Shillong,jskhumuckcham@gmail.com,31-03-18,31-03-18,,,
U74999MN2017PTC013606,YAKAIROL ENGINEERING SERVICES PRIVATELIMITED,Active,Private,Company limited by Shares,Non-govt company,21-11-17,Manipur,1000000,300000,74999,Other business activities,"11B - 4/7 SANGAIPROU MAMANG LEIKAI IMPHAL , West Imphal Unclassified MN 795001",RoC-Shillong,sanrosthok@gmail.com,31-03-20,31-03-20,,,
U74999MN2017PTC013608,AYAM INDUSTRIES PRIVATE LIMITED,Active,Private,Company limited by Shares,Non-govt company,27-11-17,Manipur,100000,100000,74999,Other business activities,"IED-III 5-D-7/1, HOUSE NO-38 YUMNAM LEIKAI WEST IMPHAL , West Imphal Unclassified MN 795001",RoC-Shillong,ayamkhaba7@gmail.com,31-03-20,31-03-20,,,
U74999MN2017PTC013612,TSM DEVELOPERS PRIVATE LIMITED,Active,Private,Company limited by Shares,Non-govt company,19-12-17,Manipur,1000000,100000,74999,Other business activities,"SAMUSHANG UKU, SANA LEIRAK LAMPHELPAT IMPHAL , West Imphal Unclassified MN 795004",RoC-Shillong,TAYENJAMS73@GMAIL.COM,31-03-18,31-03-18,,,
U74999MN2018NPL013639,SOUTH ASIAN RURAL AND AGRICULTURALMANAGEMENT FOUNDATION,Active,Private,Company limited by Shares,Non-govt company,14-03-18,Manipur,10000000,928590,74999,Other business activities,"KOMBIREI HOUSE, HIJAGANG LANE IMPHAL MUNICIPAL COUNCIL POROMPAT SUB-DIVISION , East Imphal Unclassified MN 795005",RoC-Shillong,OUGRICPL@GMAIL.COM,31-03-19,31-03-19,,,
U74999MN2018NPL013641,INCOTE FOUNDATION,Active,Private,Company limited by Shares,Non-govt company,16-03-18,Manipur,1000000,750000,74999,Other business activities,"I & B BUILDING NEAR KEISHAMTHONG HIGH S ELANGBAM LEIKAI, LEIRAK ACHOUBA IMPHAL WEST , West Imphal Unclassified MN 795001",RoC-Shillong,caprashantrajesh@gmail.com,NA,NA,,,
U74999MN2018NPL013645,PLACEMAKING FOUNDATION,Active,Private,Company limited by Shares,Non-govt company,22-03-18,Manipur,1000000,100000,74999,Other business activities,"Singjamei Thongam Leikai Imphal , West Imphal Unclassified MN 795001",RoC-Shillong,caprashantrajesh@gmail.com,31-03-20,31-03-20,,,
U74999MN2018NPL013715,SANAHANBI FOUNDATION,Active,Private,Company limited by Shares,Non-govt company,19-07-18,Manipur,100000,100000,74999,Other business activities,"Thoubal, Ningombam, Mamang, leikai, Thoubal Sub- Division THOUBAL , Thoubal Unclassified MN 795138",RoC-Shillong,pcsvaibhavgarg@gmail.com,NA,NA,,,
U74999MN2018OPC013684,SANAMAHI AGRO FOODS (OPC) PRIVATELIMITED,Active,Private(One Person Company),Company limited by Shares,Non-govt company,07-06-18,Manipur,100000,100000,74999,Other business activities,"SAWOMBUNG BLOCK, OPPOSITE SAWOMBUNG SUB-DIVISION IMPHAL EAST , East Imphal Unclassified MN 795010",RoC-Shillong,luwangagroindustries@gmail.com,NA,NA,,,
U74999MN2018OPC013686,KANAMJEM NETWORK (OPC) PRIVATE LIMITED,Active,Private(One Person Company),Company limited by Shares,Non-govt company,11-06-18,Manipur,50000,50000,74999,Other business activities,"B. Aijalon, Bijang Churachandpur CHURACHANDPUR , Churachandpur Unclassified MN 795128",RoC-Shillong,h.haokipssb@gmail.com,31-03-20,31-03-20,,,
U74999MN2018OPC013696,BOK XPRESS (OPC) PRIVATE LIMITED,Active,Private(One Person Company),Company limited by Shares,Non-govt company,20-06-18,Manipur,100000,100000,74999,Other business activities,"C/O Th.Ningthem Singh,Bashikhong Bazar Near Water Reservior IMPHAL , East Imphal Unclassified MN 795008",RoC-Shillong,thokchomkirankumar94@gmail.com,NA,NA,,,
U74999MN2018OPC013757,SINTHA ENTERPRISES (OPC) PRIVATE LIMITED,Active,Private(One Person Company),Company limited by Shares,Non-govt company,24-10-18,Manipur,100000,100000,74999,Other business activities,"IED- III (87) 4- D- 13/7 Chingamathak Nameirakpam Leikai PO PS IMPHAL WEST , West Imphal Unclassified MN 795001",RoC-Shillong,tongbram02@gmail.com,31-03-20,31-03-20,,,
U74999MN2018OPC013779,DIMARKUS VENTURES (OPC) PRIVATE LIMITED,Active,Private(One Person Company),Company limited by Shares,Non-govt company,13-12-18,Manipur,100000,100000,74999,Other business activities,"C/O Dr R.K Rajbihari,IED -III 4-EA-10/11 385/357, Village No.26 Wangkheirakpam LEIKAI, IMPHAL , East Imphal Unclassified MN 795001",RoC-Shillong,dimarkus.info@gmail.com,31-03-19,31-03-20,,,
U74999MN2018PTC013620,KHABA ENTERPRISE PRIVATE LIMITED,Active,Private,Company limited by Shares,Non-govt company,04-01-18,Manipur,100000,100000,74999,Other business activities,"KHA IMPHAL KEISHAM LEIKAI IMPHAL WEST , West Imphal Unclassified MN 795001",RoC-Shillong,st.khaba@gmail.com,31-03-19,31-03-19,,,
U74999MN2018PTC013621,CHINGSUBAM IT AND MANUFACTURING PRIVATELIMITED,Active,Private,Company limited by Shares,Non-govt company,09-01-18,Manipur,1000000,500000,74999,Other business activities,"2407 THANGMEIBAND YUMNAM LEIKAI IMPHAL , West Imphal Unclassified MN 795004",RoC-Shillong,hellochingsubam@gmail.com,NA,NA,,,
U74999MN2018PTC013624,ORCALO FOOD AND AGRO PRIVATE LIMITED,Active,Private,Company limited by Shares,Non-govt company,12-01-18,Manipur,1000000,1000000,74999,Other business activities,"3895 SAGOLBAND KWAKEITHEL BAZAR IMPHAL , West Imphal Unclassified MN 795001",RoC-Shillong,thbide0@gmail.com,NA,NA,,,
U74999MN2018PTC013630,FITZROY SALAI VENTURES PRIVATE LIMITED,Active,Private,Company limited by Shares,Non-govt company,22-02-18,Manipur,5000000,1000000,74999,Other business activities,"SAGOLBAND, TERA LOUKRAKPAM LAIKAI IMPHAL West Imphal MN 795001 IN WEST IMPHAL , West Imphal Unclassified MN 795001",RoC-Shillong,roc@taxamicus.com,NA,NA,,,
U74999MN2018PTC013633,LEIBAK INFORMATION TECHNOLOGY PRIVATELIMITED,Active,Private,Company limited by Shares,Non-govt company,27-02-18,Manipur,100000,100000,74999,Other business activities,"IED-IV UPS/UR/144 Khurai Sajor Leikai East Imphal , East Imphal Unclassified MN 795010",RoC-Shillong,lenin.nkl@gmail.com,31-03-19,31-03-19,,,
U74999MN2018PTC013634,BSTB IMPHAL PRIVATE LIMITED,Active,Private,Company limited by Shares,Non-govt company,12-03-18,Manipur,100000,75000,74999,Other business activities,"BASHIKHONG KITANA PANUNG NEAR BASHIKHONG BAZAR IMPHAL , East Imphal Unclassified MN 795008",RoC-Shillong,OKRAMTOLEN@GMAIL.COM,NA,NA,,,
U74999MN2018PTC013638,BOBOI AND BOYAI ENTERPRISES PRIVATELIMITED,Active,Private,Company limited by Shares,Non-govt company,14-03-18,Manipur,1000000,1000000,74999,Other business activities,"C/o Thokchom Suresh Singh Kwakeithel Thokchom Leikai IMPHAL , West Imphal Unclassified MN 795001",RoC-Shillong,suresh.thokchom@gmail.com,NA,NA,,,
U74999MN2018PTC013642,MIPAX REAL ESTATE CONSULTANT PRIVATELIMITED,Active,Private,Company limited by Shares,Non-govt company,19-03-18,Manipur,1000000,1000000,74999,Other business activities,"SANGAIPROU OPPOSITE FCS GODOWN GATE OPPOSITE IMPHAL , West Imphal Unclassified MN 795001",RoC-Shillong,RICKESKH@GMAIL.COM,31-03-20,31-03-20,,,
U74999MN2018PTC013644,VARCAL AGROTECH PRIVATE LIMITED,Active,Private,Company limited by Shares,Non-govt company,22-03-18,Manipur,500000,500000,74999,Other business activities,"C/o Calvin Shadokpam Wangkhei Lourembam Leirak, POROMPAT , East Imphal Unclassified MN 795005",RoC-Shillong,pcsvaibhavgarg@gmaiil.com,NA,NA,,,
U74999MN2018PTC013646,WELHUEX INDIA PRIVATE LIMITED,Active,Private,Company limited by Shares,Non-govt company,26-03-18,Manipur,100000,100000,74999,Other business activities,"336, 9-L-94, THANGAL BAZAR, IMPHAL , West Imphal Unclassified MN 795001",RoC-Shillong,khnepolean@gmail.com,31-03-20,31-03-20,,,
U74999MN2018PTC013647,FIBERFI TECH PRIVATE LIMITED,Active,Private,Company limited by Shares,Non-govt company,26-03-18,Manipur,500000,500000,74999,Other business activities,"11883, 15-B-6 MOIRANG NINGTHOU LEIRAK WEST IMPHAL , West Imphal Unclassified MN 795001",RoC-Shillong,danielmong.17@gmail.com,31-03-20,31-03-20,,,
U74999MN2018PTC013650,VARCAL AGROFOODS PRIVATE LIMITED,Active,Private,Company limited by Shares,Non-govt company,03-04-18,Manipur,500000,500000,74999,Other business activities,"C/o Calvin Shadokpam Wangkhei Lourembam Leirak, POROMPAT , East Imphal Unclassified MN 795005",RoC-Shillong,pcsvaibhavgarg@gmaiil.com,NA,NA,,,
U74999MN2018PTC013653,NECATEL SOLUTIONS PRIVATE LIMITED,Active,Private,Company limited by Shares,Non-govt company,06-04-18,Manipur,3000000,500000,74999,Other business activities,"C/O TIKENDRA SINGH NUNGLEPPAM URIPOK BACHASPATI LEIKAI, LAMPHEL IMPHAL , West Imphal Unclassified MN 795001",RoC-Shillong,tikenbiomed@gmail.com,31-03-20,31-03-20,,,
U74999MN2018PTC013656,TECAFE SALAI VENTURES PRIVATE LIMITED,Active,Private,Company limited by Shares,Non-govt company,10-04-18,Manipur,5000000,1000000,74999,Other business activities,"C/O NARENGBAM SAMARJIT SINGH, SAGOLBAND TERA LOUKRAKPAM, LEIKAI, WEST IMPHAL IMPHAL , West Imphal Unclassified MN 795001",RoC-Shillong,roc@taxamicus.com,NA,NA,,,
U74999MN2018PTC013661,KOKTAI PRIVATE LIMITED,Active,Private,Company limited by Shares,Non-govt company,20-04-18,Manipur,500000,100000,74999,Other business activities,"58, LANTHUNGCHING LANGOL IMPHAL IMPHAL , East Imphal Unclassified MN 795004",RoC-Shillong,mca21.mis@gmail.com,31-03-20,31-03-20,,,
U74999MN2018PTC013662,PUNSHIUKAL CONSULTANCY PRIVATE LIMITED,Active,Private,Company limited by Shares,Non-govt company,24-04-18,Manipur,100000,10000,74999,Other business activities,"Uripok Tourangbam Colony,Ward No. 4, House No. 54, Uripok Road IMPHAL WEST- 1 , West Imphal Unclassified MN 795001",RoC-Shillong,thangjam_rk@yahoo.com,NA,NA,,,
U74999MN2018PTC013663,HARMAT ENTERPRISE PRIVATE LIMITED,Active,Private,Company limited by Shares,Non-govt company,25-04-18,Manipur,1000000,400000,74999,Other business activities,"PISHUMTHONG NONGTHOMBAM LEIRAK NEAR IRABOT STATUE IMPHAL , West Imphal Unclassified MN 795001",RoC-Shillong,NAMARJEETE@GMAIL.COM,31-03-20,31-03-20,,,
U74999MN2018PTC013665,IWAARI MEDIA AND ENTERTAINMENT PRIVATELIMITED,Active,Private,Company limited by Shares,Non-govt company,09-05-18,Manipur,100000,100000,74999,Other business activities,"House No 204, BPR-W/11, Ngaikhong Khullen Road, Bishnupur Mamang Leikai BISHNUPUR , Bishnupur Unclassified MN 795126",RoC-Shillong,shamtom2222@gmail.com,31-03-20,31-03-20,,,
U74999MN2018PTC013672,SANGLENMAPAN AUTOMOBILES PRIVATE LIMITED,Active,Private,Company limited by Shares,Non-govt company,23-05-18,Manipur,500000,500000,74999,Other business activities,"C/O Thokchom Shyamkishor Singh,Khangabok Cherapur Khunou ,Leikai Part -III THOUBAL , Thoubal Unclassified MN 795138",RoC-Shillong,sunilthokcom@gmail.com,31-03-20,31-03-20,,,
U74999MN2018PTC013673,YELHOUMEE ENTERPRISES PRIVATE LIMITED,Active,Private,Company limited by Shares,Non-govt company,23-05-18,Manipur,100000,100000,74999,Other business activities,"C/O NINGTHOUJAM TOMBA SINGH S/ONINGTHOUJAM BABU SINGH, KHONGHAMPAT MANTRI LEIKAI IMPHAL , West Imphal Unclassified MN 795002",RoC-Shillong,LEGALRAASTACLIENTS@GMAIL.COM,31-03-20,31-03-20,,,
U74999MN2018PTC013679,KANGLASHA SERVICE PRIVATE LIMITED,Active,Private,Company limited by Shares,Non-govt company,30-05-18,Manipur,400000,400000,74999,Other business activities,"C/o Yumnam Shyamkishwor Singh Chingamathak Pishum Leirak,Nr Hao Ground P.O IMPHAL, P.S:SINGJAMEI , West Imphal Unclassified MN 795001",RoC-Shillong,fc.kanglasha@gmail.com,31-03-19,31-03-19,,,
U74999MN2018PTC013680,CHAJING UNIFIED FIVE STAR SERVICESPRIVATE LIMITED,Active,Private,Company limited by Shares,Non-govt company,04-06-18,Manipur,1000000,100000,74999,Other business activities,"C/o Soibam Boinao Singh, 19 Soibam House Lilong Chajing, Mairenkhong Leikai, IMPHAL , West Imphal Unclassified MN 795130",RoC-Shillong,chandramani.m@gmail.com,NA,NA,,,
U74999MN2018PTC013682,ZINYOR TECH AND SKILLS PRIVATE LIMITED,Active,Private,Company limited by Shares,Non-govt company,04-06-18,Manipur,1000000,100000,74999,Other business activities,"SOUTH OF PG PETROLEUM, NEAR VISHAL MART CHINGMEIRONG EAST, IMPHAL EAST I, IMPHAL , East Imphal Unclassified MN 795010",RoC-Shillong,YENGKHOM.666@GMAIL.COM,NA,NA,,,
U74999MN2018PTC013683,KAZOK LOOMS PRIVATE LIMITED,Active,Private,Company limited by Shares,Non-govt company,07-06-18,Manipur,100000,100000,74999,Other business activities,"450 Viewland Zone II UKHRUL , Ukhrul Unclassified MN 795142",RoC-Shillong,mca21.mis@gmail.com,NA,NA,,,
