CORPORATE_IDENTIFICATION_NUMBER,Company_Name,Company_status,Company_class,Company_Category,Company_sub_category,DATE_OF_REGISTRATION,REGISTERED_STATE,AUTHORIZED_CAP,PAIDUP_CAPITAL,Industrial_Class,PRINCIPAL_BUSINESS_ACTIVITY_AS_PER_CIN,Registered_Office_Address,REGISTRAR_OF_COMPANIES,EMAIL_ADDR,Latest_Year_AR,Latest_Year_BS,,,
U40108MN2015PTC008419,MANGALGI TUNG INBA RENEWABLE ENERGYGENERATION PRIVATE LIMITED,Under Process of Striking off,Private,Company limited by Shares,Non-govt company,09-04-15,Manipur,1000000,500000,40108,"Electricity, gas, steam and hot water supply","C/o Salam Tomal Meitei, Kakching Wairi Sabal Leikai, Bamon Pareng Kakching , Thoubal Unclassified MN 795103",RoC-Shillong,hempad@rediffmail.com,31-03-16,31-03-16,,,
U41000MN2015PTC008444,ERAMDAMGI LEICHIL AQUAPROJECTS PRIVATELIMITED,Active,Private,Company limited by Shares,Non-govt company,06-10-15,Manipur,1000000,100000,41000,"Electricity, gas, steam and hot water supply","DEWLAHLAND POROMPAT SUB DIVISION IMPHAL EAST , Unclassified MN 795005",RoC-Shillong,NA,31-03-20,31-03-20,,,
U41000MN2017PTC013549,BSION PRO PRIVATE LIMITED,Active,Private,Company limited by Shares,Non-govt company,19-07-17,Manipur,1000000,1000000,41000,"Electricity, gas, steam and hot water supply","SINGJAMEI CHINGAMAKHA LIWA ROAD NINGTHOUJAM LEIKAI IMPHAL WEST , West Imphal Unclassified MN 795008",RoC-Shillong,bisonpropvtltd@gmail.com,31-03-20,31-03-20,,,
U41000MN2018PTC013706,VIORAYYS VENTURE PRIVATE LIMITED,Active,Private,Company limited by Shares,Non-govt company,11-07-18,Manipur,1000000,1000000,41000,"Electricity, gas, steam and hot water supply","C/O. MAIBAM MADHABI DEVI, IED-II E3-242-KL-242, M.M. MANSION, NEAR DC OFF NAOREMTHONG KHULEM LEIKAI , West Imphal Unclassified MN 795001",RoC-Shillong,viorayys@yahoo.com,NA,NA,,,
U45101MN2017PTC013577,SINSHANG ENGINEERING CONSULTANCYSERVICES PRIVATE LIMITED,Active,Private,Company limited by Shares,Non-govt company,18-09-17,Manipur,10000000,4000000,45101,Construction,"HOUSE NO. IM-1042 BLDG. GROUND FLOOR, M. G. AVENUE IMPHAL , West Imphal Unclassified MN 795001",RoC-Shillong,leninmanipur@gmail.com,31-03-20,31-03-20,,,
U45200MN2015PTC008438,INTERCONSTRUCTION MANAGEMENT DESIGN &BUILD PRIVATE LIMITED,Strike Off,Private,Company limited by Shares,Non-govt company,31-07-15,Manipur,1000000,1000000,45200,Construction,"HOUSE NO-9, ELECTORAL WARD NO-14 MOIRANGKHOM YAISKUL CHINGAKHAM IMPHAL , East Imphal Unclassified MN 795001",RoC-Shillong,bedhajit2@yahoo.co.in,NA,NA,,,
U45200MN2017PTC013576,MRD CONCORD PRIVATE LIMITED,Active,Private,Company limited by Shares,Non-govt company,06-09-17,Manipur,2500000,100000,45200,Construction,"Lalambung Makhong, Takhellambam Leikai, Lamphelpat Sub Division, Imphal , West Imphal Unclassified MN 795004",RoC-Shillong,oinamromesh93@gmail.com,31-03-20,31-03-20,,,
U45200MN2019PTC013788,MARJING CONSTRUCTION PRIVATE LIMITED,Active,Private,Company limited by Shares,Non-govt company,02-01-19,Manipur,1000000,200000,45200,Construction,"HOUSE NO. 130, C/O KHUNDRAKPAM LEISHEMBA MEITEI, VILLAGE NO. 95 TAOTHONG, KHUNOU, IMPHAL WEST , West Imphal Unclassified MN 795146",RoC-Shillong,amitpareek99@yahoo.com,NA,NA,,,
U45200MN2019PTC013988,LRS INFRASTRUCTURE PRIVATE LIMITED,Active,Private,Company limited by Shares,Non-govt company,06-12-19,Manipur,5000000,3000000,45200,Construction,"IED-II, 25-A-8/7 (NC), CHANGANGEI, OPP. AIRPORT, WEST IMPHAL , West Imphal Unclassified MN 795001",RoC-Shillong,rolsphy@gmail.com,NA,NA,,,
U45200MN2020PTC014102,JAMES KHALING CONSTRUCTION PRIVATELIMITED,Active,Private,Company limited by Shares,Non-govt company,08-07-20,Manipur,1500000,100000,45200,Construction,"MAJORKHUL GATE, M. G. AVENUE, IMPHAL , West Imphal Unclassified MN 795001",RoC-Shillong,entpsidata@gmail.com,NA,NA,,,
U45200MN2021PTC014268,RS KANGLEI CONSTRUCTION & CONSULTANTPRIVATE LIMITED,Active,Private,Company limited by Shares,Non-govt company,10-03-21,Manipur,100000,100000,45200,Construction,"17331, 2-N-28/21, NEW CHECHOW, CSD-II IMPHAL IMPHAL , East Imphal Unclassified MN 795004",RoC-Shillong,CLIENT@LEGALRAASTA.COM,NA,NA,,,
U45201MN1997PTC005266,MANIPUR CONSTRUCTION AND DEVELOPMENT PVT LTD,Strike Off,Private,Company limited by Shares,Non-govt company,04-12-97,Manipur,500000,57000,45201,Construction,"GOVERNOR ROAD, I IMPHAL MANIPUR , Unclassified MN 795001",RoC-Shillong,NA,NA,NA,,,
U45201MN2007PTC008238,R.K.FORTUNE DEVELOPERS PRIVATE LIMITED,Active,Private,Company limited by Shares,Non-govt company,21-07-07,Manipur,30000000,20000000,45201,Construction,"Changangei Awang Leikai Imphal , Unclassified MN 795001",RoC-Shillong,rkfdpl@yahoo.com,31-03-19,31-03-19,,,
U45201MN2008PTC008240,BIKUND INFRA PRIVATE LIMITED,Active,Private,Company limited by Shares,Non-govt company,09-06-08,Manipur,40000000,5400000,45201,Construction,"LEIREN MANSION OPP. LAMPHEL SUPER MARKET IMPHAL , Unclassified MN 795001",RoC-Shillong,dkbc_imp@rediffmail.com,31-03-16,31-03-16,,,
U45201MN2010PTC008254,LTS CONSTRUCTION AND PROJECTS PRIVATELIMITED,Active,Private,Company limited by Shares,Non-govt company,19-02-10,Manipur,1000000,100000,45201,Construction,"KYAMGEI PAL AHANBI IMPHAL , East Imphal Unclassified MN 795003",RoC-Shillong,ranadhirpal@gmail.com,NA,NA,,,
U45201MN2010PTC008259,ADT CONSTRUCTION PRIVATE LIMITED,Active,Private,Company limited by Shares,Non-govt company,03-06-10,Manipur,10000000,450000,45201,Construction,"C/O MRS. ROHINI GOLMEIS BUILDING, KAKULONG, PAONA BAZAR, IMPHAL WEST IMPHAL , West Imphal Unclassified MN 795001",RoC-Shillong,d_dasassociates2010@yahoo.com,NA,NA,,,
U45201MN2010PTC008266,HILLS AND PLAIN CONSTRUCTION PRIVATELIMITED,Active,Private,Company limited by Shares,Non-govt company,23-07-10,Manipur,1000000,200000,45201,Construction,"CHINGA MAKHA LIWA ROAD, BOKUL MAKHONG P.O. SINGJAMEI IMPHAL , West Imphal Unclassified MN 795008",RoC-Shillong,hillsplainconstpvtltd@gmail.com,NA,NA,,,
U45201MN2010PTC008271,RHV CONSTRUCTION PRIVATE LIMITED,Active,Private,Company limited by Shares,Non-govt company,23-11-10,Manipur,5000000,290000,45201,Construction,"G G SHOPPING COMPLEX GOVERNOR ROAD, PAONA BAZAR IMPHAL , Unclassified MN 795001",RoC-Shillong,rhvconstructionpvtltd@gmail.com,31-03-20,31-03-20,,,
U45201MN2011PTC008273,UNIFIED BUILDTECH COMPANY PRIVATELIMITED,Active,Private,Company limited by Shares,Non-govt company,28-01-11,Manipur,500000,400000,45201,Construction,"KAKWA MAKHA NAMEIRAKPAM LEIKAI SINGJAMEI IMPHAL , East Imphal Unclassified MN 795008",RoC-Shillong,eminem.19@ibibo.com,NA,NA,,,
U45201MN2011PTC008280,KATHEY REALTORS PRIVATE LIMITED,Active,Private,Company limited by Shares,Non-govt company,27-05-11,Manipur,500000,100000,45201,Construction,"Wangkhei Ningthem Pukhri Mapal, Imphal East Manipur , Unclassified MN 795001",RoC-Shillong,lanjingba@gmail.com,31-03-18,31-03-18,,,
U45201MN2011PTC008282,KHUMAN CONSTRUCTIONS PRIVATE LIMITED,Strike Off,Private,Company limited by Shares,Non-govt company,17-06-11,Manipur,5000000,1000000,45201,Construction,"64, RIMS ROAD PO/PS LAMPHELPAT IMPHAL , Unclassified MN 795004",RoC-Shillong,navinkalaca@yahoo.com,31-03-13,31-03-13,,,
U45201MN2011PTC008293,TECHBUILDER CONSTRUCTIONS PRIVATELIMITED,Active,Private,Company limited by Shares,Non-govt company,28-11-11,Manipur,500000,500000,45201,Construction,"SANGAIPROU MANING FCI MAKHA LEIKAI IMPHAL WEST , West Imphal Unclassified MN 795001",RoC-Shillong,maisnam_ranjit@yahoo.com,NA,NA,,,
U45201MN2011PTC008294,QUALIKRIT INTFRATECH PRIVATE LIMITED,Active,Private,Company limited by Shares,Non-govt company,02-12-11,Manipur,500000,200000,45201,Construction,"KEISHAMTHONG MOIRANGNINGTHOU LEIRAK IMPHAL , West Imphal Unclassified MN 795001",RoC-Shillong,ynishanthbabu@gmail.com,NA,NA,,,
U45201MN2012PTC008306,SUBHLIFE CONSTRUCTION PRIVATE LIMITED,Active,Private,Company limited by Shares,Non-govt company,13-06-12,Manipur,10000000,8700000,45201,Construction,"KHONGMAN ZONE III (WEST) IMPHAL , Unclassified MN 795001",RoC-Shillong,subhlifeconstr@gmail.com,31-03-20,31-03-20,,,
U45201MN2013PTC008330,EREIPAK ENTERPRISES PRIVATE LIMITED,Active,Private,Company limited by Shares,Non-govt company,18-03-13,Manipur,500000,150000,45201,Construction,"KABO LEIKAI, KEKRUPAT NORTH AOC IMPHAL WEST , West Imphal Unclassified MN 795001",RoC-Shillong,ereipake@gmail.com,31-03-20,31-03-20,,,
U45201MN2014PTC008377,OUGRI INFRASTRUCTURE PRIVATE LIMITED,Active,Private,Company limited by Shares,Non-govt company,06-06-14,Manipur,500000,500000,45201,Construction,"ALU-GALI, THANGAL BAZAR PLOT NO.209/791, V/NO.87(A) IMPHAL , West Imphal Unclassified MN 795001",RoC-Shillong,ak57singh@gmail.com,31-03-17,31-03-17,,,
U45201MN2014PTC008395,MEITEI CONSTRUCTION (INDIA) PRIVATELIMITED,Strike Off,Private,Company limited by Shares,Non-govt company,19-12-14,Manipur,5000000,1000000,45201,Construction,"Khumbong Makha Leikai P.O. Langjing Patsoi Imphal , West Imphal Unclassified MN 795113",RoC-Shillong,moiran25@gmail.com,NA,NA,,,
U45201MN2015PTC008405,QUBIK INFRA PRIVATE LIMITED,Active,Private,Company limited by Shares,Non-govt company,08-01-15,Manipur,25000000,25000000,45201,Construction,"MTC BUILDING OPPOSITE UCO BANK THANGAL BAZAAR IMPHAL , West Imphal Unclassified MN 795001",RoC-Shillong,patni.nikhil90@gmail.com,31-03-20,31-03-20,,,
U45201MN2015PTC008428,EASTERN ENTREPRENEURS PRIVATE LIMITED,Strike Off,Private,Company limited by Shares,Non-govt company,21-05-15,Manipur,1000000,200000,45201,Construction,"HUIREM LEIKAI, STANDARD COLLEGE RO KONGBA, PO-IMPHAL IMPHAL , Unclassified MN 795001",RoC-Shillong,NA,NA,NA,,,
U45201MN2015PTC008435,MEETEI CONSTRUCTION PRIVATE LIMITED,Active,Private,Company limited by Shares,Non-govt company,08-07-15,Manipur,20000000,5100000,45201,Construction,"Thawanthaba Leikai, Ayabgpali Road Imphal East Porompat , East Imphal Unclassified MN 795010",RoC-Shillong,ashok@meeteicpl.com,31-03-20,31-03-20,,,
U45201MN2016PTC013494,LYS CONSTRUCTION PRIVATE LIMITED,Active,Private,Company limited by Shares,Non-govt company,05-10-16,Manipur,4000000,100000,45201,Construction,"C/o LAISHRAM YAIMA SINGH KWAKEITHEL MAKHA, THOKCHOM LEIKAI Imphal , West Imphal Unclassified MN 795001",RoC-Shillong,leninmanipur@gmail.com,31-03-19,31-03-19,,,
U45201MN2018PTC013708,KEISHAM ENTERPRISES PRIVATE LIMITED,Active,Private,Company limited by Shares,Non-govt company,13-07-18,Manipur,10000000,1000000,45201,Construction,"Yairipok Bishnunaha PO/PS Yairipok YAIRIPOK , Thoubal Unclassified MN 795149",RoC-Shillong,pcsvaibhavgarg@gmail.com,31-03-19,NA,,,
U45201MN2018PTC013769,RAINBOWLINES ENTERPRISES PRIVATE LIMITED,Active,Private,Company limited by Shares,Non-govt company,14-11-18,Manipur,1000000,300000,45201,Construction,"149/7-HTA HAFIZ HATTA (Landmark:near war cemetery) IMPHAL East Imphal MN 795001 IMPHAL , East Imphal Unclassified MN 795001",RoC-Shillong,abdulium@gmail.com,31-03-20,31-03-20,,,
U45201MN2019PTC013787,CHIDORI INFRACOM PRIVATE LIMITED,Active,Private,Company limited by Shares,Non-govt company,01-01-19,Manipur,1000000,500000,45201,Construction,"C/O RAJANI DEVI 26/3 BABUPARA IMPHAL , West Imphal Unclassified MN 795001",RoC-Shillong,chidoriinfracom@gmail.com,31-03-20,31-03-20,,,
U45201MN2019PTC013817,YAILEN GLOBAL ENTERPRISES PRIVATELIMITED,Active,Private,Company limited by Shares,Non-govt company,12-02-19,Manipur,1000000,100000,45201,Construction,"H/o Oinam Oken Singh Kwakeithel Soibam Leikai Imphal , West Imphal Unclassified MN 795001",RoC-Shillong,nameirakpam24@gmail.com,31-03-20,31-03-20,,,
U45201MN2020OPC014123,RK ROSE CONSTRUCTION DESIGN ANDDEVELOPERS (OPC) PRIVATE LIMITED,Active,Private(One Person Company),Company limited by Shares,Non-govt company,01-08-20,Manipur,1000000,100000,45201,Construction,"C/O. S. inaoba SINGH IED-IV 111-6RS, KHURAI CHINGANGBAM LEIKAI IMPHAL , East Imphal Unclassified MN 795005",RoC-Shillong,CSPUINACHANDRA@GMAIL.COM,NA,NA,,,
U45201MN2020PTC014077,NKF INFRA PROJECT PRIVATE LIMITED,Active,Private,Company limited by Shares,Non-govt company,07-05-20,Manipur,1000000,30000,45201,Construction,"13328 RAGAILONG STADIUM ROAD 2MH - 138 IMPHAL , West Imphal Unclassified MN 795001",RoC-Shillong,adaiphaomei123@gmail.com,NA,NA,,,
U45201MN2020PTC014100,SUID & JOJO PRIVATE LIMITED,Active,Private,Company limited by Shares,Non-govt company,06-07-20,Manipur,200000,100000,45201,Construction,"C/o Thokchom Irabanta Singh Meitram Makha Leikai, P.O Tulihal Imphal , West Imphal Unclassified MN 795140",RoC-Shillong,Filingbazaarroc@gmail.com,NA,NA,,,
U45201MN2020PTC014141,EXO IMPERIUM PRIVATE LIMITED,Active,Private,Company limited by Shares,Non-govt company,01-09-20,Manipur,100000,100000,45201,Construction,"SINGH LONGJAM RAGHUMANI, C/O LONGJAM NELSON SINGH,URIPOK POLEM LEIKAI IMPHAL , West Imphal Unclassified MN 795004",RoC-Shillong,exoimper@gmail.com,NA,NA,,,
U45201MN2021PTC014227,FINESSKI INFRA PRIVATE LIMITED,Active,Private,Company limited by Shares,Non-govt company,06-01-21,Manipur,500000,200000,45201,Construction,"C/O KONGBRAILATPAM RADHA, PAONA BAZAR, GOVERNO ROAD, NEAR HDFC IMPHAL , West Imphal Unclassified MN 795001",RoC-Shillong,finesski@gmail.com,NA,NA,,,
U45201MN2021PTC014234,LBSS INFRA PROJECTS PRIVATE LIMITED,Active,Private,Company limited by Shares,Non-govt company,18-01-21,Manipur,500000,100000,45201,Construction,"I ED-III 8 - EB -8/1 Brahmapur Bhagabati Leikai Imphal Imphal , West Imphal Unclassified MN 795001",RoC-Shillong,cs@setindiabiz.com,NA,NA,,,
U45201MN2021PTC014264,CHENGLUK PRIVATE LIMITED,Active,Private,Company limited by Shares,Non-govt company,08-03-21,Manipur,1500000,100000,45201,Construction,"SAGOLBAND SADOKPAM LEIKAI IMPHAL WEST IMPHAL , West Imphal Unclassified MN 795001",RoC-Shillong,chenglukpvtltd@gmail.com,NA,NA,,,
U45202MN1999PTC005810,MANIPUR HOUSING FINANCE COMPANY PRIVATELIMITED,Strike Off,Private,Company limited by Shares,Non-govt company,06-07-99,Manipur,2500000,2500000,45202,Construction,"KANYATHONG ROAD IMPHAL, , Unclassified MN 795001",RoC-Shillong,NA,NA,NA,,,
U45202MN2009PTC008248,SALAI CONSTRUCTION PRIVATE LIMITED,Active,Private,Company limited by Shares,Non-govt company,21-07-09,Manipur,68000000,67555000,45202,Construction,"SAGOLBAND TERA LOUKRAKPAM LEIKAI IMPHAL , West Imphal Unclassified MN 795001",RoC-Shillong,construction@smartmanipur.com,31-03-19,31-03-19,,,
U45202MN2011PTC008279,RADHEY CONSTRUCTIONS & SUPPLY PRIVATELIMITED,Active,Private,Company limited by Shares,Non-govt company,09-05-11,Manipur,500000,100000,45202,Construction,"C/O E. SOMORENDRO SINGH SAGOLBAND MANTRI LEIKAI IMPHAL , Ukhrul Unclassified MN 795001",RoC-Shillong,eminem.19@ibibo.com,NA,NA,,,
U45202MN2011PTC008283,DT CONSTRUCTIONS & PROJECTS PRIVATELIMITED,Active,Private,Company limited by Shares,Non-govt company,30-06-11,Manipur,10000000,1000000,45202,Construction,"C/O MRS. ROHINI GOLMEIS BUILDING, KAKULONG, PAONA BAZAR, IMPHAL WEST IMPHAL , West Imphal Unclassified MN 795001",RoC-Shillong,d_dasassociates@yahoo.co.in,NA,NA,,,
U45202MN2011PTC008284,LAISHRAM CONSTRUCTIONS PRIVATE LIMITED,Active,Private,Company limited by Shares,Non-govt company,08-08-11,Manipur,500000,300000,45202,Construction,"PAONA BAZAR, NEAR USHA CINEMA HALL IMPHAL , West Imphal Unclassified MN 795001",RoC-Shillong,pravin.cs@rediffmail.com,NA,NA,,,
U45202MN2011PTC008288,KCHAND INFRASTRUCTURE PRIVATE LIMITED,Active,Private,Company limited by Shares,Non-govt company,26-09-11,Manipur,500000,500000,45202,Construction,"SAGOLBAN MEINO LEIRAK IMPHAL WEST IMPHAL , West Imphal Unclassified MN 795001",RoC-Shillong,lal_maisanam@yahoo.com,NA,NA,,,
U45202MN2014PTC008387,AAKIFAH INFRASTRUCTURES PRIVATE LIMITED,Active,Private,Company limited by Shares,Non-govt company,09-09-14,Manipur,10000000,2249000,45202,Construction,"CHINGMEIRONG TANGKHUL AVENUE P.O.- LAMLONG, P.S.- LAMPHEL IMPHAL , East Imphal Unclassified MN 795010",RoC-Shillong,aakifahipl@gmail.com,31-03-19,31-03-19,,,
U45202MN2015PTC008445,YESS INFRASTRUCTURES PRIVATE LIMITED,Active,Private,Company limited by Shares,Non-govt company,07-10-15,Manipur,10000000,100000,45202,Construction,"THANGMEIBAND POLEM LEIKAI IMPHAL , Unclassified MN 795001",RoC-Shillong,NA,31-03-18,31-03-19,,,
U45202MN2016OPC008466,BRAJABIDHUANDSONS CONSTRUCTIONMANAGEMENT (OPC) PRIVATE LIMITED,Active,Private(One Person Company),Company limited by Shares,Non-govt company,18-03-16,Manipur,1000000,300000,45202,Construction,"LANGTHABAL LEP MAYAI LEIKAI PO - CANCHIPUR IMPHAL WEST , Unclassified MN 795003",RoC-Shillong,bhomendrolaimayum@outlook.com,31-03-18,31-03-18,,,
U45202MN2021PTC014251,YUMNAM CONSTRUCTION PRIVATE LIMITED,Active,Private,Company limited by Shares,Non-govt company,11-02-21,Manipur,1500000,110000,45202,Construction,"C/O MR. RATAN YUMNAM, IED-III 63-MV-N/G1, YUMNAM LEIKAI, MU AWANG GATE IMPHAL , West Imphal Unclassified MN 795003",RoC-Shillong,ougricpl@gmail.com,NA,NA,,,
U45203MN1981PTC001878,MANIPUR BUILDERS & CONSTRUCTION CO PVT LTD,Strike Off,Private,Company limited by Shares,Non-govt company,27-04-81,Manipur,5000000,61000,45203,Construction,"LAXMI BAZAR MANIPUR CENTRAL DISTRICT IMPHAL , Unclassified MN 795001",RoC-Shillong,NA,NA,NA,,,
U45203MN1991PTC003541,GRAND CONSTRUCTION COMPANY PVT LTD,Strike Off,Private,Company limited by Shares,Non-govt company,14-05-91,Manipur,1000000,30000,45203,Construction,"CHINGAMAKHA MAIBAM LAIRAKIMPHAL MANIPUR , Unclassified MN 000000",RoC-Shillong,NA,NA,NA,,,
U45203MN1991PTC003601,A K BUILDERS PVT LTD,Active,Private,Company limited by Shares,Non-govt company,12-09-91,Manipur,2500000,1333000,45203,Construction,"THANGAL BAZAR IMPHAL , Unclassified MN 795001",RoC-Shillong,manraj120@gmail.com,31-03-20,31-03-20,,,
U45203MN1992PTC003679,CHAOBA CONSTRUCTION COMPANY PVT LTD,Strike Off,Private,Company limited by Shares,Non-govt company,30-03-92,Manipur,1500000,40000,45203,Construction,"SINGJAMEI MEKHA KAKWA ASEMIMPHAL MANIPUR , Unclassified MN 000000",RoC-Shillong,NA,NA,NA,,,
U45203MN1992PTC003762,BETECH ENGINEERS INDIA PVT LTD,Strike Off,Private,Company limited by Shares,Non-govt company,10-08-92,Manipur,300000,150000,45203,Construction,"B.T.ROAD IMPHAL , Unclassified MN 795001",RoC-Shillong,NA,NA,NA,,,
U45203MN1993PTC003834,PREMIER CONSULTING ENGINEERS AND ARCHITECTS PVT LTD,Strike Off,Private,Company limited by Shares,Non-govt company,11-01-93,Manipur,300000,100000,45203,Construction,"B.T.ROAD, IMPHAL, , Unclassified MN 795001",RoC-Shillong,NA,NA,NA,,,
U45203MN1993PTC003929,PAKHANGBA SPACE CONSULTANT AND DESIGNERS PVT LTD,Strike Off,Private,Company limited by Shares,Non-govt company,11-06-93,Manipur,50000,15000,45203,Construction,"SINGJAMEI THEKCHOM LEIKAI IMPHAL , Unclassified MN 000000",RoC-Shillong,NA,NA,NA,,,
U45203MN1993PTC004013,MAIBIA CONSTRUCTION ENGINEERS PRIVATELIMITED,Active,Private,Company limited by Shares,Non-govt company,28-10-93,Manipur,2500000,1850000,45203,Construction,"CHINGAMAKHA MAISNAM LEIKAIIMPHAL MANIPUR , West Imphal Unclassified MN 795001",RoC-Shillong,philipsinghmaibam@yahoo.co.in,31-03-11,31-03-11,,,
U45203MN1995PTC004645,NOVELTY CONSTRUCTION PVT LTD,Active,Private,Company limited by Shares,Non-govt company,27-12-95,Manipur,2500000,838000,45203,Construction,"THANGAL BAZAR IMPHAL , Unclassified MN 795001",RoC-Shillong,manraj120@gmail.com,31-03-20,31-03-20,,,
U45203MN2004PTC007314,LAI CONSTRUCTIONS PRIVATE LIMITED,Strike Off,Private,Company limited by Shares,Non-govt company,30-01-04,Manipur,500000,100000,45203,Construction,"AZAD TALKIES COMPLEXKAKCHING BAZAR IMPHAL , Unclassified MN 000000",RoC-Shillong,NA,NA,NA,,,
U45203MN2004PTC007383,INDIA ORBIT MARKETING PRIVATE LIMITED,Active,Private,Company limited by Shares,Non-govt company,12-04-04,Manipur,10000000,8200000,45203,Construction,"THANGAL BAZARIMPHAL MANIPUR , Unclassified MN 795001",RoC-Shillong,patni.nikhil90@gmail.com,31-03-20,31-03-20,,,
U45203MN2006PTC008231,AXIAL BUILDERS PRIVATE LIMITED,Active,Private,Company limited by Shares,Non-govt company,22-09-06,Manipur,5000000,3300000,45203,Construction,"GRACE MANSION OPPOSITE PALACE GATE,KUNUNGURAMANG IMPHAL , Unclassified MN 795001",RoC-Shillong,builderaxial@gmail.com,31-03-20,31-03-20,,,
U45203MN2007PTC008236,EXOTIC CONTRACTORS PRIVATE LIMITED,Active,Private,Company limited by Shares,Non-govt company,08-05-07,Manipur,10000000,10000000,45203,Construction,"PUNANAMEI P.O.MAO MAO , Unclassified MN 795150",RoC-Shillong,pasip@rediffmail.com,31-03-19,31-03-19,,,
U45203MN2012PTC008302,JEJO CONSTRUCTION PRIVATE LIMITED,Active,Private,Company limited by Shares,Non-govt company,20-03-12,Manipur,1000000,200000,45203,Construction,"GRACE BHAVAN MOTBUNG VILLAGE , Senapati Unclassified MN 795107",RoC-Shillong,jonathan_sitlhou@hotmail.com,NA,NA,,,
U45203MN2013PTC008350,ARAMBAI CONTRACTORS AND CONSULTANTSPRIVATE LIMITED,Strike Off,Private,Company limited by Shares,Non-govt company,21-08-13,Manipur,100000,100000,45203,Construction,"NAHARUP HUIREM LEIKAI VILL NO- 44-THANGBRIJAO POROMPAT , East Imphal Unclassified MN 795001",RoC-Shillong,pravin.cs@rediffmail.com,NA,NA,,,
U45203MN2016PTC008462,KANGLEI ENTERPRISES PRIVATE LIMITED,Active,Private,Company limited by Shares,Non-govt company,03-03-16,Manipur,1000000,100000,45203,Construction,"CHANGANGEI MAKHA LEIKAI TULIHAL , Unclassified MN 795140",RoC-Shillong,machathoi@gmail.com,NA,NA,,,
U45203MN2016PTC008467,IRENGBAM CONSTRUCTION AND SUPPLY PRIVATE LIMITED,Active,Private,Company limited by Shares,Non-govt company,21-03-16,Manipur,100000,100000,45203,Construction,"TORBAN KSHETRI LEIKAI NORTH N/SEYO CLUB SINGJAMEI IMPHAL , Unclassified MN 795001",RoC-Shillong,usharaninaoroibam@gmail.com,NA,NA,,,
U45206MN1997ULL005012,MANIPUR STATE POWER DEVELOPMENT CORPORATION LIMITED,Strike Off,Public,Unlimited Company,State Govt company,17-03-97,Manipur,750000000,500,45206,Construction,"MANIPUR , Unclassified MN",RoC-Shillong,mspdcl@rediffmail.com,NA,NA,,,
U45208MN2015PTC008421,NORTH EAST NEW TOWN DEVELOPMENT PRIVATELIMITED,Active,Private,Company limited by Shares,Non-govt company,09-04-15,Manipur,10000000,1000000,45208,Construction,"SAGOLBAND, TERA LOUKRAKPAM LAIKAI IMPHAL , West Imphal Unclassified MN 795001",RoC-Shillong,newtown.salai@gmail.com,31-03-18,31-03-18,,,
U45208MN2019PTC013894,MAVEN INFRASTRUCTURE PROJECTS PRIVATELIMITED,Active,Private,Company limited by Shares,Non-govt company,05-07-19,Manipur,20000000,5000000,45208,Construction,"C/O LAISHRAM RISHIKANTA SINGH, LALAMBUNG MAKHONG, RIMS ROAD, LAMPHELPAT SUB-DIVISON, LAMPHEL, IMPHAL , West Imphal Unclassified MN 795004",RoC-Shillong,RISHIKANTAL@GMAIL.COM,31-03-20,31-03-20,,,
U45209MN2010PTC008262,ESTHER CONSTRUCTION PRIVATE LIMITED,Active,Private,Company limited by Shares,Non-govt company,11-06-10,Manipur,20000000,1000000,45209,Construction,"KHUYATHONG,NEAR ABC GODOWN IMPHAL IMPHAL , Unclassified MN 795001",RoC-Shillong,rakeshimp@gmail.com,31-03-13,31-03-13,,,
U45209MN2012PTC008308,BIJOY & SONS' ENTERPRISES PRIVATELIMITED,Strike Off,Private,Company limited by Shares,Non-govt company,31-07-12,Manipur,5000000,1000000,45209,Construction,"KULABIDHU BUILDING M G VAENUE THANGAL BAZAR IMPHAL , West Imphal Unclassified MN 795001",RoC-Shillong,dkbc_imp@rediffmail.com,NA,NA,,,
U45209MN2013PTC008322,ZENITH SUPPLY AND CONSTRUCTION COMPANYPRIVATE LIMITED,Active,Private,Company limited by Shares,Non-govt company,18-01-13,Manipur,1000000,100000,45209,Construction,"Vill: Namthanpung, Sanjenthong Landmark: Sanjenthong IMPHAL , East Imphal Unclassified MN 795001",RoC-Shillong,keishingbountia@gmail.com,31-03-19,31-03-19,,,
U45209MN2013PTC008324,OINAM INFRA PRIVATE LIMITED,Strike Off,Private,Company limited by Shares,Non-govt company,31-01-13,Manipur,100000,100000,45209,Construction,"THOUBAL NINGOMBAM THOUBAL , Thoubal Unclassified MN 795138",RoC-Shillong,INDIRAOINAM@REDIFFMAIL.COM,NA,NA,,,
U45209MN2013PTC008346,KUNDALEI CONSTRUCTION PRIVATE LIMITED,Active,Private,Company limited by Shares,Non-govt company,24-07-13,Manipur,100000,100000,45209,Construction,"KONBA KSHETRI LEIKAI (NEAR STANDARD COLLEGE) IMPHAL , East Imphal Unclassified MN 795001",RoC-Shillong,echinglembi@gmail.com,31-03-20,31-03-20,,,
U45209MN2015PTC008426,NONGPOK HAARUM CONSTRUCTION PRIVATELIMITED,Strike Off,Private,Company limited by Shares,Non-govt company,29-04-15,Manipur,1000000,930000,45209,Construction,"C/o Okram Manimohan Singh Singjamei Okram Leikai Imphal West , West Imphal Unclassified MN 795001",RoC-Shillong,amarjitnaorem786@gmail.com,NA,NA,,,
U45209MN2017PTC013528,CHAOBA BUILDCON PRIVATE LIMITED,Active,Private,Company limited by Shares,Non-govt company,02-05-17,Manipur,2500000,500000,45209,Construction,"FIRST FLOOR, 76, LANGTHABAL LEP, NEAR CRPF CAMP, P.O./P.S. SINGJAMEI, IMPHAL WEST , West Imphal Unclassified MN 795008",RoC-Shillong,chaobabuildcons@gmail.com,31-03-19,31-03-19,,,
U45209MN2018OPC013750,MRK ASSOCIATES (OPC) PRIVATE LIMITED,Active,Private(One Person Company),Company limited by Shares,Non-govt company,30-09-18,Manipur,500000,500000,45209,Construction,"MOIRANGHKHOM, IMPHAL WEST-795001, MANIPUR (BESIDE GOODISH RESTAURANT) IMPHAL , West Imphal Unclassified MN 795001",RoC-Shillong,sinha.rajib92@gmail.com,31-03-20,31-03-20,,,
U45209MN2019PTC013844,MANJU AND KRITIKA CONSTRUCTION ANDINFRASTRUCTURE PRIVATE LIMITED,Active,Private,Company limited by Shares,Non-govt company,01-04-19,Manipur,500000,100000,45209,Construction,"ALU GALI, THANGAL BAZAR, 5TH FLOOR IMPHAL , West Imphal Unclassified MN 795001",RoC-Shillong,MAHESHKALA49@GMAIL.COM,31-03-20,31-03-20,,,
U45209MN2019PTC013856,LANGYAI VENTURES PRIVATE LIMITED,Active,Private,Company limited by Shares,Non-govt company,22-04-19,Manipur,1000000,100000,45209,Construction,"C/o H Bonyson, Babupara, Imphal,Opposite Council of Higher Secondary Education IMPHAL , East Imphal Unclassified MN 795001",RoC-Shillong,hbsingh36@gmail.com,NA,NA,,,
U45209MN2019PTC013911,VCHS ASSOCIATES PRIVATE LIMITED,Active,Private,Company limited by Shares,Non-govt company,19-07-19,Manipur,1000000,500000,45209,Construction,"C/o-MR.SUJIT KAR,SEROU PART 2,KEKRUPOKPI NEAR POST OFFICE,THOUBAL MANIPUR , West Imphal Unclassified MN 795101",RoC-Shillong,arktassociates01@gmail.com,NA,NA,,,
